{
  "run_id": "python-proof-loop-full-20260408T224144Z",
  "generated_at": "2026-04-08T22:41:44.316307+00:00",
  "corpus_manifest": "tests/corpora/python_proof_loop_corpus.json",
  "corpus_manifest_hash": "sha256:0c3b78d3b092277d89bb79a7df485b3f794b3ae30668acbed4fba318b48e4398",
  "split_mode": "simulated_no_training",
  "duplicates": [],
  "near_duplicates": [],
  "leakage_flags": []
}
